Entity,citation,identifier,title,label
https://prometheusprotocols.net/function/water-relations/hydraulic-conductance-and-conductivity/,"Choat, Brendan. 2010. Hydraulic Conductance and Conductivity. PROMETHEUS. 2010. https://prometheusprotocols.net/function/water-relations/hydraulic-conductance-and-conductivity/.",url:https://prometheusprotocols.net/function/water-relations/hydraulic-conductance-and-conductivity/,Hydraulic Conductance and Conductivity,Choat 2010
https://prometheusprotocols.net/function/water-relations/pressure-volume-curves/leaf-pressure-volume-curve-parameters/,"Sack, Lawren, Jessica Pasquet-Kok, and Megan Bartlett. Leaf pressure-volume curve parameters: protocol. PROMETHEUS. (2022, March 27). Retrieved December 15, 2022, from https://prometheusprotocols.net/function/water-relations/pressure-volume-curves/leaf-pressure-volume-curve-parameters/",url:prometheusprotocols.net/function/water-relations/pressure-volume-curves/leaf-pressure-volume-curve-parameters/,Leaf pressure-volume curve parameters: protocol,Sack 2022
https://prometheusprotocols.net/function/water-relations/xylem-vulnerability-curves/,"Cochard, Hervé. 2010. Xylem Vulnerability Curves. Prometheus. 2010. https://prometheusprotocols.net/function/water-relations/xylem-vulnerability-curves/.",url:https://prometheusprotocols.net/function/water-relations/xylem-vulnerability-curves/,Xylem Vulnerability Curves,Cochard 2010
https://scholar.google.com/citations?view_op=view_citation&hl=en&user=Z8v6xPMAAAAJ&cstart=20&pagesize=80&sortby=pubdate&citation_for_view=Z8v6xPMAAAAJ:YOwf2qJgpHMC,"Wells, Jessie Anne. Phylogeny and inter-relations of ecological traits and seed dispersal in rainforest plants: exploring aspects of functional diversity in primary and secondary rainforests in Australias Wet Tropics. Ph.D. Thesis, University of Queensland (2012).",url:scholar.google.com/citations?view_op=view_citation&hl=en&user=Z8v6xPMAAAAJ&cstart=20&pagesize=80&sortby=pubdate&citation_for_view=Z8v6xPMAAAAJ:YOwf2qJgpHMC,Phylogeny and inter-relations of ecological traits and seed dispersal in rainforest plants: Exploring aspects of functional diversity in primary and secondary rainforests in Australias Wet Tropics.,Wells 2012
https://www.wiley.com/en-us/Water+Use+Efficiency+in+Plant+Biology-p-9781405149990,"Jones, Hamlyn G. 2009. What Is Water Use Efficiency? In Water Use Efficiency in Plant Biology. John Wiley & Sons.",ISBN:978-1-405-14999-0,What is Water Use Efficiency?,Jones 2009
