identifier,label,description,Parent,exactMatch,tier_1,tier_2,tier_3,tier_4,hierarchy
trait_group_0030006,whole plant phenotype trait,A plant life history trait which is a whole plant phenotype [FLOPO:0000089].,https://w3id.org/APD/traits/trait_group_0030001,,life history trait,whole plant phenotype trait,,,whole plant phenotype trait < life history trait
trait_group_0030008,plant phenological trait,A growth and development trait [TO:0000357] which is the timing of the occurrence of plant structure development stages [PO:0009012] and the relevant biological processes [GO:0008150].,https://w3id.org/APD/traits/trait_group_0030001,http://purl.obolibrary.org/obo/TO_0000933,life history trait,plant phenological trait,,,plant phenological trait < life history trait
trait_group_0030009,interspecific interactions trait,A plant life history trait that captures an interspecific interaction between organisms [GO:0044419].,https://w3id.org/APD/traits/trait_group_0030001,,life history trait,interspecific interactions trait,,,interspecific interactions trait < life history trait
trait_group_0030059,genetic structure trait,A plant life history trait that captures information about genetic structures.,https://w3id.org/APD/traits/trait_group_0030001,,life history trait,genetic structure trait,,,genetic structure trait < life history trait
trait_group_0030504,reproductive structure life history trait,A plant life history trait pertaining to a plants reproductive structures [UBERON:0005156].,https://w3id.org/APD/traits/trait_group_0030001,,life history trait,reproductive structure life history trait,,,reproductive structure life history trait < life history trait
trait_group_0030602,fire response trait,A plant life history trait indicating adaptations [NCIT:C158868] to increase survival rate [EnvThes:21065] or seed germination [GO_0009845] rate following fire [ENVO:01000786] or indicating a plants response [NCIT:C25755] to fire.,https://w3id.org/APD/traits/trait_group_0030001,,life history trait,fire response trait,,,fire response trait < life history trait
trait_group_0030702,chemical stress sensitivity trait,Response by the plant in terms of resistivity or senility to chemical stress.,https://w3id.org/APD/traits/trait_group_0030001,http://purl.obolibrary.org/obo/TO_0000482,life history trait,chemical stress sensitivity trait,,,chemical stress sensitivity trait < life history trait
trait_group_0030704,environmental tolerance trait,A plant life history trait indicating adaptations [NCIT:C158868] to specific environmental conditions [ENVO:01000203] or tolerance [NCIT:C43414] to specific environmental stresses [EnvThes:21245].,https://w3id.org/APD/traits/trait_group_0030001,,life history trait,environmental tolerance trait,,,environmental tolerance trait < life history trait